<xs:schema xmlns:xs="http://www.w3.org/2001/XMLSchema">
    <xs:element name="restaurante">
        <xs:complexType>
            <xs:sequence>
                <xs:element name="mesa" maxOccurs="unbounded">
                    <xs:complexType>
                        <xs:sequence>
                            <xs:element name="numeroMesa">
                                <xs:simpleType>
                                    <xs:restriction base="xs:string">
                                        <xs:pattern value="\d{2}"/>
                                    </xs:restriction>
                                </xs:simpleType>
                            </xs:element>
                            <xs:element name="capacidadMesa">
                                <xs:simpleType>
                                    <xs:restriction base="xs:integer">
                                        <xs:minInclusive value="1"/>
                                    </xs:restriction>
                                </xs:simpleType>
                            </xs:element>
                            <xs:element name="estadoMesa">
                                <xs:simpleType>
                                    <xs:restriction base="xs:string">
                                        <xs:enumeration value="Libre"/>
                                        <xs:enumeration value="Reservada"/>
                                    </xs:restriction>
                                </xs:simpleType>
                            </xs:element>
                        </xs:sequence>
                    </xs:complexType>
                </xs:element>
                <xs:element name="reserva" maxOccurs="unbounded">
                    <xs:complexType>
                        <xs:sequence>
                            <xs:element name="idReserva">
                                <xs:simpleType>
                                    <xs:restriction base="xs:string">
                                        <xs:pattern value="RESERVA-\d{3}"/>
                                    </xs:restriction>
                                </xs:simpleType>
                            </xs:element>
                            <xs:element name="nombreCliente" type="xs:string"/>
                            <xs:element name="fechaReserva">
                                <xs:simpleType>
                                    <xs:restriction base="xs:string">
                                        <xs:pattern value="\d{4}-\d{2}-\d{2}"/>
                                    </xs:restriction>
                                </xs:simpleType>
                            </xs:element>
                            <xs:element name="horaReserva">
                                <xs:simpleType>
                                    <xs:restriction base="xs:string">
                                        <xs:pattern value="\d{2}:\d{2}"/>
                                    </xs:restriction>
                                </xs:simpleType>
                            </xs:element>
                            <xs:element name="menuPersonalizado">
                                <xs:complexType>
                                    <xs:sequence>
                                        <xs:element name="plato" maxOccurs="unbounded">
                                            <xs:simpleType>
                                                <xs:restriction base="xs:string">
                                                    <xs:minLength value="2"/>
                                                </xs:restriction>
                                            </xs:simpleType>
                                        </xs:element>
                                        <xs:element name="bebida" maxOccurs="unbounded">
                                            <xs:simpleType>
                                                <xs:restriction base="xs:string">
                                                    <xs:minLength value="2"/>
                                                </xs:restriction>
                                            </xs:simpleType>
                                        </xs:element>
                                    </xs:sequence>
                                </xs:complexType>
                            </xs:element>
                            <xs:element name="pedidos">
                                <xs:complexType>
                                    <xs:sequence>
                                        <xs:element name="plato" maxOccurs="unbounded">
                                            <xs:simpleType>
                                                <xs:restriction base="xs:string">
                                                    <xs:minLength value="2"/>
                                                </xs:restriction>
                                            </xs:simpleType>
                                        </xs:element>
                                        <xs:element name="bebida" maxOccurs="unbounded">
                                            <xs:simpleType>
                                                <xs:restriction base="xs:string">
                                                    <xs:minLength value="2"/>
                                                </xs:restriction>
                                            </xs:simpleType>
                                        </xs:element>
                                    </xs:sequence>
                                </xs:complexType>
                            </xs:element>
                            <xs:element name="totalPedido">
                                <xs:simpleType>
                                    <xs:restriction base="xs:decimal">
                                        <xs:minInclusive value="0.01"/>
                                    </xs:restriction>
                                </xs:simpleType>
                            </xs:element>
                        </xs:sequence>
                    </xs:complexType>
                </xs:element>
            </xs:sequence>
        </xs:complexType>
    </xs:element>
</xs:schema>
